	split	rot-categorization	rot-judgment	action	action-agree	situation	rot	extracted_actions
1917	none	['description']	it is okay	wanting to be included.	3.0	not letting my assistant patrol leader arrange a camp and not let me join	It is okay to want to be included.	[Token(lemma='want', pos='VERB'), Token(lemma='include', pos='VERB')]
1918	none	['description']	It is okay	wanting to be included.	False	not letting my assistant patrol leader arrange a camp and not let me join	It is okay to want to be included.	[Token(lemma='want', pos='VERB'), Token(lemma='include', pos='VERB')]
1919	none	['advice']	should	Considering taking a painkiller if you have period pain.	3.0	needing to take painkillers for period pain	If you have period pain you should consider taking a painkiller.	[Token(lemma='consider', pos='VERB'), Token(lemma='take', pos='VERB'), Token(lemma='have', pos='VERB')]
1920	none	['advice']	you should	If you have period pain, considering taking a painkiller.	3.0	needing to take painkillers for period pain	If you have period pain you should consider taking a painkiller.	[Token(lemma='have', pos='VERB'), Token(lemma='consider', pos='VERB'), Token(lemma='take', pos='VERB')]
1921	none	['social-norms']	It's wrong	wanting your neighbor to be evicted.	False	wanting my neighbors evicted	It's wrong to want your neighbor to be evicted.	[Token(lemma='want', pos='VERB'), Token(lemma='evict', pos='VERB')]
1922	none	['morality-ethics']	It's wrong	wanting your neighbor to be evicted.	3.0	wanting my neighbors evicted	It's wrong to want your neighbor to be evicted.	[Token(lemma='want', pos='VERB'), Token(lemma='evict', pos='VERB')]
1923	none	['advice']	{}	Try doing some light exercise to reduce period pain before resorting to painkillers.	False	needing to take painkillers for period pain	Try doing some light exercise to reduce period pain before resorting to painkillers.	[Token(lemma='try', pos='VERB'), Token(lemma='do', pos='VERB'), Token(lemma='reduce', pos='VERB'), Token(lemma='resort', pos='VERB')]
1924	none	['advice']	{}	Try doing some light exercise to reduce period pain before resorting to painkillers.	False	needing to take painkillers for period pain	Try doing some light exercise to reduce period pain before resorting to painkillers.	[Token(lemma='try', pos='VERB'), Token(lemma='do', pos='VERB'), Token(lemma='reduce', pos='VERB'), Token(lemma='resort', pos='VERB')]
1925	none	['morality-ethics']	It is rude	excluding people from organized events.	3.0	not letting my assistant patrol leader arrange a camp and not let me join	It is rude to exclude people from organized events.	[Token(lemma='exclude', pos='VERB'), Token(lemma='organize', pos='VERB')]
1926	none	['social-norms']	rude	excluding people from organized events.	3.0	not letting my assistant patrol leader arrange a camp and not let me join	It is rude to exclude people from organized events.	[Token(lemma='exclude', pos='VERB'), Token(lemma='organize', pos='VERB')]
1927	none	['morality-ethics']	OK	Standing up for yourself when others call you fat	4.0	calling out people who offer me seats (thinking I'm pregnant)? I am not	Standing up for yourself when others call you fat is OK.	[Token(lemma='stand', pos='VERB'), Token(lemma='call', pos='VERB')]
1928	none	['description']	is OK	Standing up for yourself when others call you fat	4.0	calling out people who offer me seats (thinking I'm pregnant)? I am not	Standing up for yourself when others call you fat is OK.	[Token(lemma='stand', pos='VERB'), Token(lemma='call', pos='VERB')]
1929	none	['advice']	You shouldn't	questioning your girlfriend's decision to take painkillers if she has period pain.	3.0	needing to take painkillers for period pain	You shouldn't question your girlfriend's decision to take painkillers if she has period pain.	[Token(lemma='question', pos='VERB'), Token(lemma='take', pos='VERB'), Token(lemma='have', pos='VERB')]
1930	none	['morality-ethics']	you shouldn't	questioning your girlfriend's decision to take painkillers if she has period pain.	2.0	needing to take painkillers for period pain	You shouldn't question your girlfriend's decision to take painkillers if she has period pain.	[Token(lemma='question', pos='VERB'), Token(lemma='take', pos='VERB'), Token(lemma='have', pos='VERB')]
1931	none	['morality-ethics', 'social-norms']	should	respecting your neighbors.	4.0	wanting my neighbors evicted	You should respect your neighbors.	[Token(lemma='respect', pos='VERB')]
1932	none	['social-norms']	should	respecting your neighbors.	4.0	wanting my neighbors evicted	You should respect your neighbors.	[Token(lemma='respect', pos='VERB')]
1933	none	['morality-ethics', 'advice']	should never	leaving a person in bad health alone.	3.0	leaving my 18 year old diabetic bro at home	One should never leave a person in bad health alone.	[Token(lemma='leave', pos='VERB')]
1934	none	['morality-ethics', 'advice']	should never	someone leaving a person in bad health alone.	4.0	leaving my 18 year old diabetic bro at home	One should never leave a person in bad health alone.	[Token(lemma='leave', pos='VERB')]
1935	none	['morality-ethics', 'social-norms']	it's wrong	isolating yourself from others.	3.0	buying two bus tickets so I could sit by myself and told others they could not sit with me	It's wrong to isolate yourself from others.	[Token(lemma='isolate', pos='VERB')]
1936	none	['social-norms']	It's wrong	isolating yourself from others.	2.0	buying two bus tickets so I could sit by myself and told others they could not sit with me	It's wrong to isolate yourself from others.	[Token(lemma='isolate', pos='VERB')]
1937	none	['morality-ethics']	shouldn't	wishing bad things on your neighbors.	3.0	wanting my neighbors evicted	You shouldn't wish bad things on your neighbors.	[Token(lemma='wish', pos='VERB')]
1938	none	['morality-ethics', 'social-norms']	shouldn't	wishing bad things on your neighbors.	4.0	wanting my neighbors evicted	You shouldn't wish bad things on your neighbors.	[Token(lemma='wish', pos='VERB')]
1939	none	['social-norms']	it's rude	yelling at people who are trying to be nice to you with good intentions.	4.0	calling out people who offer me seats (thinking I'm pregnant)? I am not	It's rude to yell at people who are trying to be nice to you with good intentions.	[Token(lemma='yell', pos='VERB'), Token(lemma='try', pos='VERB')]
1940	none	['morality-ethics']	Its rude	Yelling at people who are trying to be nice to you with good intentions.	4.0	calling out people who offer me seats (thinking I'm pregnant)? I am not	It's rude to yell at people who are trying to be nice to you with good intentions.	[Token(lemma='yell', pos='VERB'), Token(lemma='try', pos='VERB')]
1941	none	['advice']	It is okay	distancing yourself from toxic people, even if they are family.	3.0	not speaking to my dad in 3 years	It is okay to distance yourself from toxic people, even if they are family.	[Token(lemma='distance', pos='VERB')]
1942	none	['social-norms']	It is okay	distancing yourself from toxic people, even if they are family.	3.0	not speaking to my dad in 3 years	It is okay to distance yourself from toxic people, even if they are family.	[Token(lemma='distance', pos='VERB')]
1943	none	['social-norms']	it's fine	wanting to be alone	3.0	buying two bus tickets so I could sit by myself and told others they could not sit with me	It's fine to want to be alone.	[Token(lemma='want', pos='VERB')]
1944	none	['advice']	it's fine	wanting to be alone.	3.0	buying two bus tickets so I could sit by myself and told others they could not sit with me	It's fine to want to be alone.	[Token(lemma='want', pos='VERB')]
1945	none	['morality-ethics']	It's wrong	letting others take seats next to you on a bus.	3.0	buying two bus tickets so I could sit by myself and told others they could not sit with me	It's wrong to not let others take seats next to you on a bus.	[Token(lemma='let', pos='VERB'), Token(lemma='take', pos='VERB')]
1946	none	['social-norms']	It's wrong	not letting others take seats next to you on a bus.	3.0	buying two bus tickets so I could sit by myself and told others they could not sit with me	It's wrong to not let others take seats next to you on a bus.	[Token(lemma='let', pos='VERB'), Token(lemma='take', pos='VERB')]
1947	none	['morality-ethics']	It is bad	having sex with your friends' crushes.	3.0	sleeping with my college friend's high school crush	It is bad to have sex with your friends' crushes.	[Token(lemma='have', pos='VERB')]
1948	none	['morality-ethics', 'social-norms']	It is bad	having sex with your friends' crushes.	4.0	sleeping with my college friend's high school crush	It is bad to have sex with your friends' crushes.	[Token(lemma='have', pos='VERB')]
1949	none	['morality-ethics', 'social-norms']	It's wrong	having an open relationship with a significant other.	False	telling my girlfriend we are not very compatible sex wise and asking if we can have an open relationship	It's wrong to have an open relationship with a significant other.	[Token(lemma='have', pos='VERB')]
1950	none	['morality-ethics']	It's wrong	having an open relationship with a significant other.	3.0	telling my girlfriend we are not very compatible sex wise and asking if we can have an open relationship	It's wrong to have an open relationship with a significant other.	[Token(lemma='have', pos='VERB')]
1951	none	['morality-ethics', 'social-norms']	It is stupid	getting angry over petty things.	3.0	getting mad at my sister for not knowing how to spell my first name	It is stupid to get angry over petty things.	[Token(lemma='get', pos='VERB')]
1952	none	['advice']	{}	It is stupid to get angry over petty things.	False	getting mad at my sister for not knowing how to spell my first name	It is stupid to get angry over petty things.	[Token(lemma='get', pos='VERB')]
1953	none	['advice']	It's good	discussing important topics with your loved ones.	3.0	telling my girlfriend we are not very compatible sex wise and asking if we can have an open relationship	It's good to discuss important topics with your loved ones.	[Token(lemma='discuss', pos='VERB')]
1954	none	['social-norms']	it's good	discussing important topics with your loved ones.	4.0	telling my girlfriend we are not very compatible sex wise and asking if we can have an open relationship	It's good to discuss important topics with your loved ones.	[Token(lemma='discuss', pos='VERB')]
1955	none	['social-norms']	It is expected	cutting family extra slack.	3.0	getting mad at my sister for not knowing how to spell my first name	It is expected that you cut family extra slack.	[Token(lemma='cut', pos='VERB')]
1956	none	['social-norms']	It is expected	cutting family extra slack.	2.0	getting mad at my sister for not knowing how to spell my first name	It is expected that you cut family extra slack.	[Token(lemma='cut', pos='VERB')]
1957	none	['social-norms']	you should	asking if family members would like to accompany them on outings.	3.0	leaving my 18 year old diabetic bro at home	One should ask if family members would like to accompany them on outings.	[Token(lemma='ask', pos='VERB'), Token(lemma='like', pos='VERB'), Token(lemma='accompany', pos='VERB')]
1958	none	['social-norms']	should	asking if family members would like to accompany them on outings.	3.0	leaving my 18 year old diabetic bro at home	One should ask if family members would like to accompany them on outings.	[Token(lemma='ask', pos='VERB'), Token(lemma='like', pos='VERB'), Token(lemma='accompany', pos='VERB')]
1959	none	['social-norms']	should always	including your friends.	4.0	not wanting my obese friend to ride in my car	You should always include your friends.	[Token(lemma='include', pos='VERB')]
1960	none	['social-norms']	You should	always including your friends.	3.0	not wanting my obese friend to ride in my car	You should always include your friends.	[Token(lemma='include', pos='VERB')]
1961	none	['morality-ethics']	it is appropriate	taking sexual harassment issues to the authorities	4.0	exposing a (former) friend's for sexually harassing me	It is appropriate to take sexual harassment issues to the authorities.	[Token(lemma='take', pos='VERB')]
1962	none	['social-norms', 'advice']	it's appropriate	taking sexual harassment issues to the authorities.	4.0	exposing a (former) friend's for sexually harassing me	It is appropriate to take sexual harassment issues to the authorities.	[Token(lemma='take', pos='VERB')]
1963	none	['social-norms', 'advice']	It's good	talking to significant others about sex.	4.0	telling my girlfriend we are not very compatible sex wise and asking if we can have an open relationship	It's good to talk to significant others about sex.	[Token(lemma='talk', pos='VERB')]
1964	none	['social-norms']	It's good	talking to significant others about sex.	3.0	telling my girlfriend we are not very compatible sex wise and asking if we can have an open relationship	It's good to talk to significant others about sex.	[Token(lemma='talk', pos='VERB')]
1965	none	['social-norms']	You shouldn't	looking down on your friends for being fat.	3.0	not wanting my obese friend to ride in my car	You shouldn't look down on your friends for being fat.	[Token(lemma='look', pos='VERB')]
1966	none	['morality-ethics', 'social-norms']	You shouldn't	Looking down on your friends for being fat.	4.0	not wanting my obese friend to ride in my car	You shouldn't look down on your friends for being fat.	[Token(lemma='look', pos='VERB')]
1967	none	['morality-ethics', 'social-norms']	It is bad	keeping sexual harassment secret	3.0	exposing a (former) friend's for sexually harassing me	It is bad to keep sexual harassment secret.	[Token(lemma='keep', pos='VERB')]
1968	none	['morality-ethics', 'advice']	It is bad	keeping sexual harassment secret.	4.0	exposing a (former) friend's for sexually harassing me	It is bad to keep sexual harassment secret.	[Token(lemma='keep', pos='VERB')]
1969	none	['social-norms']	It is not unreasonable	expecting a family member to know your name.	3.0	getting mad at my sister for not knowing how to spell my first name	It is not unreasonable to expect a family member to know your name.	[Token(lemma='expect', pos='VERB'), Token(lemma='know', pos='VERB')]
1970	none	['description']	It is not unreasonable	expecting a family member to know your name.	3.0	getting mad at my sister for not knowing how to spell my first name	It is not unreasonable to expect a family member to know your name.	[Token(lemma='expect', pos='VERB'), Token(lemma='know', pos='VERB')]
1971	none	['social-norms', 'advice']	it's okay	not wanting to talk about the same thing as someone else does.	2.0	talking about something my friend didn't want to talk about	It's okay if you don't want to talk about the same thing as someone else does.	[Token(lemma='want', pos='VERB'), Token(lemma='talk', pos='VERB'), Token(lemma='do', pos='VERB')]
1972	none	['advice']	It's okay	not wanting to talk about the same thing as someone else does.	3.0	talking about something my friend didn't want to talk about	It's okay if you don't want to talk about the same thing as someone else does.	[Token(lemma='want', pos='VERB'), Token(lemma='talk', pos='VERB'), Token(lemma='do', pos='VERB')]
1973	none	['morality-ethics', 'advice']	You shouldn't	ostracizing your friends for things they cannot control.	4.0	not wanting my obese friend to ride in my car	You shouldn't ostracize your friends for things they cannot control.	[Token(lemma='ostracize', pos='VERB'), Token(lemma='control', pos='VERB')]
1974	none	['morality-ethics', 'social-norms']	You shouldn't	ostracizing your friends for things they cannot control.	3.0	not wanting my obese friend to ride in my car	You shouldn't ostracize your friends for things they cannot control.	[Token(lemma='ostracize', pos='VERB'), Token(lemma='control', pos='VERB')]
1975	none	['morality-ethics']	very horrible	wishing your family members dead.	4.0	preferring my dad to die	It is very horrible to wish your family members dead.	[Token(lemma='wish', pos='VERB')]
1976	none	['morality-ethics']	is very horrible	wishing your family members dead.	4.0	preferring my dad to die	It is very horrible to wish your family members dead.	[Token(lemma='wish', pos='VERB')]
1977	none	['social-norms']	It is disrespectful	not  knowing how to spell your siblings name.	3.0	getting mad at my sister for not knowing how to spell my first name	It is disrespectful not to know how to spell your siblings name.	[Token(lemma='know', pos='VERB'), Token(lemma='spell', pos='VERB')]
1978	none		{}	It is disrespectful not to know how to spell your siblings name.	False	getting mad at my sister for not knowing how to spell my first name	It is disrespectful not to know how to spell your siblings name.	[Token(lemma='know', pos='VERB'), Token(lemma='spell', pos='VERB')]
1979	none	['description']	It's okay	wanting to your friend to listen when you want to talk about something.	False	talking about something my friend didn't want to talk about	It's okay to want to your friend to listen when you want to talk about something.	[Token(lemma='want', pos='VERB'), Token(lemma='listen', pos='VERB'), Token(lemma='want', pos='VERB'), Token(lemma='talk', pos='VERB')]
1980	none	['morality-ethics']	It's okay	wanting your friend to listen when you want to talk about something.	False	talking about something my friend didn't want to talk about	It's okay to want to your friend to listen when you want to talk about something.	[Token(lemma='want', pos='VERB'), Token(lemma='listen', pos='VERB'), Token(lemma='want', pos='VERB'), Token(lemma='talk', pos='VERB')]
1981	none	['social-norms']	it's rude	not attending a birthday party given for you	4.0	ditching my own birthday party	It's rude not to attend a birthday party given for you	[Token(lemma='attend', pos='VERB'), Token(lemma='give', pos='VERB')]
1982	none	['social-norms']	it's rude	not attending a birthday party given for you	4.0	ditching my own birthday party	It's rude not to attend a birthday party given for you	[Token(lemma='attend', pos='VERB'), Token(lemma='give', pos='VERB')]
1983	none	['advice']	it's wrong	not participating in work events.	3.0	never bringing food to work potlucks	It's wrong to not participate in work events.	[Token(lemma='participate', pos='VERB')]
1984	none	['social-norms']	It's wrong	not participating in work events.	2.0	never bringing food to work potlucks	It's wrong to not participate in work events.	[Token(lemma='participate', pos='VERB')]
1985	none	['advice']	one should not	being jealous of those close to them.	3.0	being jealous of my best friend	One should not be jealous of those close to them.	[]
1986	none	['social-norms', 'advice']	One should not	being jealous of those close to them.	3.0	being jealous of my best friend	One should not be jealous of those close to them.	[]
1987	none	['social-norms']	it's good	putting on a birthday party for someone else	3.0	ditching my own birthday party	It's good to put on a birthday party for someone else	[Token(lemma='put', pos='VERB')]
1988	none	['description']	It's good	putting on a birthday party for someone else	4.0	ditching my own birthday party	It's good to put on a birthday party for someone else	[Token(lemma='put', pos='VERB')]
1989	none	['morality-ethics', 'social-norms']	should always	One cheering on those close to them.	3.0	being jealous of my best friend	One should always cheer those close to them on.	[Token(lemma='cheer', pos='VERB')]
1990	none	['social-norms']	should	cheering those close to them on.	4.0	being jealous of my best friend	One should always cheer those close to them on.	[Token(lemma='cheer', pos='VERB')]
1991	none	['morality-ethics']	it's bad	lying	4.0	lying about my boyfriend's age	It's bad to lie.	[Token(lemma='lie', pos='VERB')]
1992	none	['social-norms']	bad	lying	4.0	lying about my boyfriend's age	It's bad to lie.	[Token(lemma='lie', pos='VERB')]
1993	none	['morality-ethics']	good	helping your family with their money problems.	3.0	trying to understand what was made of my aunt's money. she is mentally challenged	It's good to help your family with their money problems.	[Token(lemma='help', pos='VERB')]
1994	none	['social-norms']	It's good	helping your family with their money problems.	3.0	trying to understand what was made of my aunt's money. she is mentally challenged	It's good to help your family with their money problems.	[Token(lemma='help', pos='VERB')]
1995	none	['social-norms']	It is expected	a party occuring on someone's birthday	3.0	ditching my own birthday party	It is expected that a party will occur on someone's birthday	[Token(lemma='occur', pos='VERB')]
1996	none	['social-norms']	{}	It is expected that a party will occur on someone's birthday	False	ditching my own birthday party	It is expected that a party will occur on someone's birthday	[Token(lemma='expect', pos='VERB'), Token(lemma='occur', pos='VERB')]
1997	none	['morality-ethics', 'social-norms']	It's wrong	not being supportive of friends.	4.0	rejecting my friend and hurting her feelings	It's wrong to not be supportive of friends.	[]
1998	none	['morality-ethics']	It's wrong	not being supportive of friends.	3.0	rejecting my friend and hurting her feelings	It's wrong to not be supportive of friends.	[]
1999	none	['social-norms']	you should	others bringing food to an event	False	never bringing food to work potlucks	If others are bringing food to an event, you should do the same.	[Token(lemma='bring', pos='VERB')]
2000	none	['social-norms']	you should	bringing food to an event when others are	3.0	never bringing food to work potlucks	If others are bringing food to an event, you should do the same.	[Token(lemma='bring', pos='VERB')]
2001	none	['advice']	It's acceptable	keeping some details about your life private.	3.0	lying about my boyfriend's age	It's acceptable to keep some details about your life private.	[Token(lemma='keep', pos='VERB')]
2002	none	['social-norms']	It's acceptable	keeping some details about your life private.	3.0	lying about my boyfriend's age	It's acceptable to keep some details about your life private.	[Token(lemma='keep', pos='VERB')]
2003	none	['description']	It is expected	growing apart from some friends.	3.0	being not sure I want to spend time with an old friend any more	It is expected some friends will grow apart.	[Token(lemma='grow', pos='VERB')]
2004	none	['description']	it's expected	some friends growing apart	False	being not sure I want to spend time with an old friend any more	It is expected some friends will grow apart.	[Token(lemma='grow', pos='VERB')]
2005	none	['social-norms', 'advice']	It's rude	canceling plans with friends in order to spend time with the person you are dating.	3.0	skipping out on a theme park trip with friends to go hang out with my girlfriend	It's rude to cancel plans with friends in order to spend time with the person you are dating.	[Token(lemma='cancel', pos='VERB'), Token(lemma='spend', pos='VERB'), Token(lemma='date', pos='VERB')]
2006	none	['social-norms']	It's rude	canceling plans with friends in order to spend time with the person you are dating.	3.0	skipping out on a theme park trip with friends to go hang out with my girlfriend	It's rude to cancel plans with friends in order to spend time with the person you are dating.	[Token(lemma='cancel', pos='VERB'), Token(lemma='spend', pos='VERB'), Token(lemma='date', pos='VERB')]
2007	none	['morality-ethics', 'social-norms']	it's wrong	not doing your share for an event.	3.0	never bringing food to work potlucks	It's wrong not to do your share for an event.	[Token(lemma='do', pos='VERB')]
2008	none	['morality-ethics']	It's wrong	not doing your share for an event.	4.0	never bringing food to work potlucks	It's wrong not to do your share for an event.	[Token(lemma='do', pos='VERB')]
2009	none	['social-norms']	It's understandable	wanting your significant other to have healthy habits.	3.0	not exercising and my boyfriend leaving me	It's understandable to want your significant other to have healthy habits.	[Token(lemma='want', pos='VERB'), Token(lemma='have', pos='VERB')]
2010	none	['advice']	its understandable	wanting your significant other to have healthy habits.	4.0	not exercising and my boyfriend leaving me	It's understandable to want your significant other to have healthy habits.	[Token(lemma='want', pos='VERB'), Token(lemma='have', pos='VERB')]
2011	none	['advice']	it is good	repairing any relationships that might fall apart	4.0	being not sure I want to spend time with an old friend any more	It is good to try to repair any relationships that might fall apart.	[Token(lemma='repair', pos='VERB'), Token(lemma='fall', pos='VERB')]
2012	none	['advice']	is good	trying to repair any relationships that might fall apart	3.0	being not sure I want to spend time with an old friend any more	It is good to try to repair any relationships that might fall apart.	[Token(lemma='try', pos='VERB'), Token(lemma='repair', pos='VERB'), Token(lemma='fall', pos='VERB')]
2013	none	['social-norms']	You should	Respecting your friends.	4.0	being mad at my friend because of their boyfriend	You should respect your friends.	[Token(lemma='respect', pos='VERB')]
2014	none	['social-norms', 'advice']	You should	respecting your friends.	4.0	being mad at my friend because of their boyfriend	You should respect your friends.	[Token(lemma='respect', pos='VERB')]
2015	none	['social-norms']	its okay	Playing music with a speaker on your bicycle when the volume is low.	4.0	playing music with a speaker on my bicycle	Playing music with a speaker on your bicycle is okay as long as the volume is low.	[Token(lemma='play', pos='VERB')]
2016	none	['social-norms', 'advice']	is okay	Playing music with a speaker on your bicycle with the volume low.	3.0	playing music with a speaker on my bicycle	Playing music with a speaker on your bicycle is okay as long as the volume is low.	[Token(lemma='play', pos='VERB')]
