	split	rot-categorization	rot-judgment	action	action-agree	situation	rot	extracted_actions
2869	none	['description']	it's expected	being able to control things when in a vehicle.	False	closing a window on the bus	It's expected to be able to control things when in a vehicle.	[Token(lemma='control', pos='VERB')]
2870	none	['social-norms']	it's expected	being able to control things when in a vehicle.	4.0	closing a window on the bus	It's expected to be able to control things when in a vehicle.	[Token(lemma='control', pos='VERB')]
2871	none	['social-norms']	It is disrespectful to your partner	talking to your ex.	2.0	getting upset with my so about communicating repeatedly with her ex	It is disrespectful to your partner to talk to your ex.	[Token(lemma='talk', pos='VERB')]
2872	none	['social-norms']	it is disrespectful	talking to your ex when you have a partner	3.0	getting upset with my so about communicating repeatedly with her ex	It is disrespectful to your partner to talk to your ex.	[Token(lemma='talk', pos='VERB'), Token(lemma='have', pos='VERB')]
2873	none	['morality-ethics', 'social-norms']	It's good	communicating with your partner.	3.0	asking my wife to tell me when I can expect her to come home from work	It's good to communicate with your partner.	[Token(lemma='communicate', pos='VERB')]
2874	none	['advice']	it's good	communnicating with your partner.	4.0	asking my wife to tell me when I can expect her to come home from work	It's good to communicate with your partner.	[Token(lemma='communnicate', pos='VERB')]
2875	none	['advice']	should	telling others what your plans are.	2.0	asking my wife to tell me when I can expect her to come home from work	You should tell others what your plans are.	[Token(lemma='tell', pos='VERB')]
2876	none	['social-norms', 'advice']	should	telling others what your plans are.	4.0	asking my wife to tell me when I can expect her to come home from work	You should tell others what your plans are.	[Token(lemma='tell', pos='VERB')]
2877	none	['social-norms']	it's expected	wanting a doctor to lose their license when malpractice is involved.	False	wanting a doctor to lose their license	It is expected to want a doctor to lose their license is malpractice is involved.	[Token(lemma='want', pos='VERB'), Token(lemma='lose', pos='VERB'), Token(lemma='involve', pos='VERB')]
2878	none	['description']	It is expected	wanting a doctor to lose their license is malpractice is involved.	4.0	wanting a doctor to lose their license	It is expected to want a doctor to lose their license is malpractice is involved.	[Token(lemma='want', pos='VERB'), Token(lemma='lose', pos='VERB'), Token(lemma='involve', pos='VERB')]
2879	none	['morality-ethics']	should never	yelling at their parents.	3.0	yelling at my father to flush the goddamn toilet	One should never yell at their parents.	[Token(lemma='yell', pos='VERB')]
2880	none	['social-norms']	should never	One yelling at their parents.	3.0	yelling at my father to flush the goddamn toilet	One should never yell at their parents.	[Token(lemma='yell', pos='VERB')]
2881	none	['morality-ethics', 'social-norms']	people should	respecting others boundaries, especially when it comes to privacy.	3.0	not wanting to take pictures with my gf	People should respect others boundaries, especially when it comes to privacy.	[Token(lemma='respect', pos='VERB'), Token(lemma='come', pos='VERB')]
2882	none	['social-norms']	People should	respecting others boundaries, especially when it comes to privacy.	3.0	not wanting to take pictures with my gf	People should respect others boundaries, especially when it comes to privacy.	[Token(lemma='respect', pos='VERB'), Token(lemma='come', pos='VERB')]
2883	none	['social-norms']	should	always cleaning up behind ones self.	4.0	yelling at my father to flush the goddamn toilet	One should always clean up behind themselves.	[Token(lemma='clean', pos='VERB')]
2884	none	['social-norms', 'advice']	One should always	cleaning up behind oneself	4.0	yelling at my father to flush the goddamn toilet	One should always clean up behind themselves.	[Token(lemma='clean', pos='VERB')]
2885	none	['morality-ethics']	should	respecting the decisions of your significant other.	4.0	making a deal out of my fiance not planning to exchange a Christmas gift he didn't like so he'll get something he does like and will use	You should respect the decisions of your significant other.	[Token(lemma='respect', pos='VERB')]
2886	none	['morality-ethics', 'social-norms']	You should	respecting the decisions of your significant other.	3.0	making a deal out of my fiance not planning to exchange a Christmas gift he didn't like so he'll get something he does like and will use	You should respect the decisions of your significant other.	[Token(lemma='respect', pos='VERB')]
2887	none	['social-norms', 'advice']	should	always leaving the bathroom clean and fresh.	4.0	yelling at my father to flush the goddamn toilet	You should always leave the bathroom clean and fresh.	[Token(lemma='leave', pos='VERB')]
2888	none	['social-norms', 'advice']	You should always	leaving the bathroom clean and fresh.	4.0	yelling at my father to flush the goddamn toilet	You should always leave the bathroom clean and fresh.	[Token(lemma='leave', pos='VERB')]
2889	none	['advice']	shouldn't	making a huge deal about things that don't concern you.	3.0	making a deal out of my fiance not planning to exchange a Christmas gift he didn't like so he'll get something he does like and will use	You shouldn't make a huge deal about things that don't concern you.	[Token(lemma='make', pos='VERB'), Token(lemma='concern', pos='VERB')]
2890	none	['advice']	You shouldn't	making a huge deal about things that don't concern you.	3.0	making a deal out of my fiance not planning to exchange a Christmas gift he didn't like so he'll get something he does like and will use	You shouldn't make a huge deal about things that don't concern you.	[Token(lemma='make', pos='VERB'), Token(lemma='concern', pos='VERB')]
2891	none	['description']	Not everyone	people enjoying having their picture taken.	3.0	not wanting to take pictures with my gf	Not everyone enjoys having their picture taken.	[Token(lemma='enjoy', pos='VERB'), Token(lemma='have', pos='VERB'), Token(lemma='take', pos='VERB')]
2892	none	['description']	it's okay	Not enjoying having their picture taken.	False	not wanting to take pictures with my gf	Not everyone enjoys having their picture taken.	[Token(lemma='enjoy', pos='VERB'), Token(lemma='have', pos='VERB'), Token(lemma='take', pos='VERB')]
2893	none	['social-norms']	Should	having a gift you don't like and exchanging it for something you do like	2.0	making a deal out of my fiance not planning to exchange a Christmas gift he didn't like so he'll get something he does like and will use	If you have a gift you don't like, you should exchange it for something you do like.	[Token(lemma='have', pos='VERB'), Token(lemma='like', pos='VERB'), Token(lemma='exchange', pos='VERB'), Token(lemma='do', pos='VERB')]
2894	none	['social-norms']	you should	exchanging a gift you don't like for something you do like.	2.0	making a deal out of my fiance not planning to exchange a Christmas gift he didn't like so he'll get something he does like and will use	If you have a gift you don't like, you should exchange it for something you do like.	[Token(lemma='exchange', pos='VERB'), Token(lemma='like', pos='VERB'), Token(lemma='do', pos='VERB')]
2895	none	['social-norms']	It's expected	spending the holidays with family.	3.0	missing Christmas with my family	It's expected that you spend the holidays with family.	[Token(lemma='spend', pos='VERB')]
2896	none	['social-norms']	It's expected	spending the holidays with family.	3.0	missing Christmas with my family	It's expected that you spend the holidays with family.	[Token(lemma='spend', pos='VERB')]
2897	none		{}	Not wanting to take a picture with a significant other can make them feel as though they're not worthwhile and hurt their feelings.	False	not wanting to take pictures with my gf	Not wanting to take a picture with a significant other can make them feel as though they're not worthwhile and hurt their feelings.	[Token(lemma='want', pos='VERB'), Token(lemma='take', pos='VERB'), Token(lemma='make', pos='VERB'), Token(lemma='feel', pos='VERB'), Token(lemma='hurt', pos='VERB')]
2898	none	['social-norms']	making a significant other feel not worthwhile	Not wanting to take a picture with a significant other can make them feel as though they're not worthwhile and hurt their feelings.	False	not wanting to take pictures with my gf	Not wanting to take a picture with a significant other can make them feel as though they're not worthwhile and hurt their feelings.	[Token(lemma='want', pos='VERB'), Token(lemma='take', pos='VERB'), Token(lemma='make', pos='VERB'), Token(lemma='feel', pos='VERB'), Token(lemma='hurt', pos='VERB')]
2899	none	['description']	is manipulative	Making someone feel obligated to do something they don't want to do	3.0	not wanting to take pictures with my gf	Making someone feel obligated to do something they don't want to do is manipulative.	[Token(lemma='make', pos='VERB'), Token(lemma='feel', pos='VERB'), Token(lemma='do', pos='VERB'), Token(lemma='want', pos='VERB'), Token(lemma='do', pos='VERB')]
2900	none	['morality-ethics']	It's manipulative	Making someone feel obligated to do something they don't want to	2.0	not wanting to take pictures with my gf	Making someone feel obligated to do something they don't want to do is manipulative.	[Token(lemma='make', pos='VERB'), Token(lemma='feel', pos='VERB'), Token(lemma='do', pos='VERB'), Token(lemma='want', pos='VERB')]
2901	none	['morality-ethics']	It is important	being honest with your friends.	3.0	telling my friend she's been overly harsh to someone who left a funeral service early	It is important to be honest with your friends.	[]
2902	none	['social-norms']	It is important	being honest with your friends.	3.0	telling my friend she's been overly harsh to someone who left a funeral service early	It is important to be honest with your friends.	[]
2903	none	['social-norms']	You should	respecting your friend's feelings.	3.0	telling my friend she's been overly harsh to someone who left a funeral service early	You should respect your friend's feelings.	[Token(lemma='respect', pos='VERB')]
2904	none	['morality-ethics']	You should	respecting your friend's feelings.	4.0	telling my friend she's been overly harsh to someone who left a funeral service early	You should respect your friend's feelings.	[Token(lemma='respect', pos='VERB')]
2905	none	['social-norms']	it is rude	leaving a funeral early	4.0	telling my friend she's been overly harsh to someone who left a funeral service early	It is rude to leave a funeral early.	[Token(lemma='leave', pos='VERB')]
2906	none	['social-norms']	It is rude	leaving a funeral early.	3.0	telling my friend she's been overly harsh to someone who left a funeral service early	It is rude to leave a funeral early.	[Token(lemma='leave', pos='VERB')]
2907	none	['social-norms', 'advice']	It is acceptable	ending a romantic relationship that makes you uncomfortable.	3.0	cooling down the relationship to a full stop because she was jelous of her friend	It is acceptable to end a romantic relationship that makes you uncomfortable.	[Token(lemma='end', pos='VERB'), Token(lemma='make', pos='VERB')]
2908	none	['description']	it's acceptable	ending a romantic relationship that makes you uncomfortable.	4.0	cooling down the relationship to a full stop because she was jelous of her friend	It is acceptable to end a romantic relationship that makes you uncomfortable.	[Token(lemma='end', pos='VERB'), Token(lemma='make', pos='VERB')]
2909	none	['advice', 'description']	is important	Trusting in a relationship	4.0	cooling down the relationship to a full stop because she was jelous of her friend	Trust is important in a relationship.	[Token(lemma='trust', pos='VERB')]
2910	none	['advice']	{}	Trust is important in a relationship.	False	cooling down the relationship to a full stop because she was jelous of her friend	Trust is important in a relationship.	[]
2911	none	['social-norms']	It is okay	wanting space and independence from your elders	False	not wanting to move closer to my fiance's parents after college	It is okay to want space and independence from your elders	[Token(lemma='want', pos='VERB')]
2912	none	['social-norms']	it is okay	wanting space and independence from your elders	False	not wanting to move closer to my fiance's parents after college	It is okay to want space and independence from your elders	[Token(lemma='want', pos='VERB')]
2913	none	['social-norms']	It is expected	family being together.	4.0	not wanting my father to see my child	It is expected for family to be together.	[]
2914	none	['social-norms', 'description']	it is expected	family being together	3.0	not wanting my father to see my child	It is expected for family to be together.	[]
2915	none	['description']	should	accepting the consequences when violating someone's trust	3.0	not telling someone's fiancée her boyfriend tried to cheat on her	If you violate someone's trust, you should accept the consequences.	[Token(lemma='accept', pos='VERB'), Token(lemma='violate', pos='VERB')]
2916	none	['morality-ethics', 'advice']	you should accept the consequences.	violating someone's trust	3.0	not telling someone's fiancée her boyfriend tried to cheat on her	If you violate someone's trust, you should accept the consequences.	[Token(lemma='violate', pos='VERB')]
2917	none	['morality-ethics']	unacceptable	cheating in a relationship.	4.0	not telling someone's fiancée her boyfriend tried to cheat on her	It is unacceptable to cheat in a relationship.	[Token(lemma='cheat', pos='VERB')]
2918	none	['morality-ethics']	it's unacceptable	cheating in a relationship.	4.0	not telling someone's fiancée her boyfriend tried to cheat on her	It is unacceptable to cheat in a relationship.	[Token(lemma='cheat', pos='VERB')]
2919	none	['social-norms']	it's wrong	getting involved in the friendships of family members.	3.0	possibly ending one of my mother's friendships over a seat belt	It's wrong to get involved in the friendships of family members.	[Token(lemma='get', pos='VERB'), Token(lemma='involve', pos='VERB')]
2920	none	['morality-ethics']	It's wrong	getting involved in the friendships of family members.	2.0	possibly ending one of my mother's friendships over a seat belt	It's wrong to get involved in the friendships of family members.	[Token(lemma='get', pos='VERB'), Token(lemma='involve', pos='VERB')]
2921	none	['morality-ethics']	It is bad	being upset with a spouse.	3.0	being upset at my bf	It is bad to be upset with a spouse.	[]
2922	none	['social-norms']	bad	being upset with a spouse	4.0	being upset at my bf	It is bad to be upset with a spouse.	[]
2923	none	['social-norms']	It is expected	being tolerant of people with disabilities.	3.0	being annoyed by someone with a mental disability	It is expected that you are tolerant of people with disabilities.	[]
2924	none	['morality-ethics', 'social-norms']	it's expected	being tolerant of people with disabilities.	4.0	being annoyed by someone with a mental disability	It is expected that you are tolerant of people with disabilities.	[]
2925	none	['social-norms', 'advice']	should	respecting your family members and their friendships.	4.0	possibly ending one of my mother's friendships over a seat belt	You should respect your family members and their friendships.	[Token(lemma='respect', pos='VERB')]
2926	none	['morality-ethics']	should	respecting your family members and their friendships.	4.0	possibly ending one of my mother's friendships over a seat belt	You should respect your family members and their friendships.	[Token(lemma='respect', pos='VERB')]
2927	none	['social-norms', 'description']	It is okay	keeping your child away from people you dislike.	3.0	not wanting my father to see my child	It is okay to keep your child away from people you dislike.	[Token(lemma='keep', pos='VERB'), Token(lemma='dislike', pos='VERB')]
2928	none	['morality-ethics']	Is ok	keeping your child away from people you dislike.	4.0	not wanting my father to see my child	It is okay to keep your child away from people you dislike.	[Token(lemma='keep', pos='VERB'), Token(lemma='dislike', pos='VERB')]
2929	none	['advice']	It's OK	taking time for yourself without your partner.	3.0	not being part of my boyfriend's Sunday game nights	It's OK to take time for yourself without your partner.	[Token(lemma='take', pos='VERB')]
2930	none	['social-norms', 'advice']	it's ok	taking time for yourself without your partner.	3.0	not being part of my boyfriend's Sunday game nights	It's OK to take time for yourself without your partner.	[Token(lemma='take', pos='VERB')]
2931	none	['advice']	it's wrong	not marrying someone just because you disapprove of his hair.	3.0	not marrying him over his hair	It's wrong to not marry someone just because you disapprove of his hair.	[Token(lemma='marry', pos='VERB'), Token(lemma='disapprove', pos='VERB')]
2932	none	['morality-ethics']	It's wrong	not marrying someone just because you disapprove of his hair.	3.0	not marrying him over his hair	It's wrong to not marry someone just because you disapprove of his hair.	[Token(lemma='marry', pos='VERB'), Token(lemma='disapprove', pos='VERB')]
2933	none	['advice']	not ok	leaving your partner out of your plans too often.	3.0	not being part of my boyfriend's Sunday game nights	It's not OK to leave your partner out of your plans too often.	[Token(lemma='leave', pos='VERB')]
2934	none	['morality-ethics', 'social-norms']	it's not OK	leaving your partner out of your plans too often	3.0	not being part of my boyfriend's Sunday game nights	It's not OK to leave your partner out of your plans too often.	[Token(lemma='leave', pos='VERB')]
2935	none	['morality-ethics']	It is frowned upon	interrupting other people's relationships.	4.0	telling a girl that I like her, especially now when she's about to get into a relationship with someone else	It is frowned upon to interrupt other people's relationships.	[Token(lemma='interrupt', pos='VERB')]
2936	none	['morality-ethics', 'social-norms']	its frowned upon	interrupting other people's relationships	3.0	telling a girl that I like her, especially now when she's about to get into a relationship with someone else	It is frowned upon to interrupt other people's relationships.	[Token(lemma='interrupt', pos='VERB')]
2937	none	['morality-ethics', 'social-norms']	It is rude	being impatient with a disabled person.	4.0	being annoyed by someone with a mental disability	It is rude to be impatient with a disabled person.	[]
2938	none	['social-norms']	It is rude	being impatient with a disabled person.	4.0	being annoyed by someone with a mental disability	It is rude to be impatient with a disabled person.	[]
2939	none	['social-norms']	it's expected	helping your family when asked.	3.0	not allowing my sister to host her kid's birthday party at my house	It is expected that you help family when asked.	[Token(lemma='help', pos='VERB'), Token(lemma='ask', pos='VERB')]
2940	none	['morality-ethics', 'social-norms']	It is expected	helping your family when asked.	3.0	not allowing my sister to host her kid's birthday party at my house	It is expected that you help family when asked.	[Token(lemma='help', pos='VERB'), Token(lemma='ask', pos='VERB')]
2941	none	['description']	It's okay	being frustrated by other people.	2.0	being annoyed by someone with a mental disability	It is okay to be frustrated by other people.	[Token(lemma='frustrate', pos='VERB')]
2942	none	['social-norms']	its okay	being frustrated by other people.	False	being annoyed by someone with a mental disability	It is okay to be frustrated by other people.	[Token(lemma='frustrate', pos='VERB')]
2943	none	['morality-ethics']	It is kind	hosting an event at your home if needed.	3.0	not allowing my sister to host her kid's birthday party at my house	It is kind to host an event at your home if needed.	[Token(lemma='host', pos='VERB'), Token(lemma='need', pos='VERB')]
2944	none	['social-norms']	is kind	hosting an event at your home if needed.	2.0	not allowing my sister to host her kid's birthday party at my house	It is kind to host an event at your home if needed.	[Token(lemma='host', pos='VERB'), Token(lemma='need', pos='VERB')]
2945	none	['morality-ethics']	It is good	having extra patients for disabled people.	4.0	being annoyed by someone with a mental disability	It is good to have extra patients for disabled people.	[Token(lemma='have', pos='VERB')]
2946	none		It is good	having extra patience for disabled people.	3.0	being annoyed by someone with a mental disability	It is good to have extra patients for disabled people.	[Token(lemma='have', pos='VERB')]
2947	none	['advice']	it is OK	declining hosting an event if you don't want to do it.	3.0	not allowing my sister to host her kid's birthday party at my house	It is OK to decline hosting an event if you don't want to do it.	[Token(lemma='decline', pos='VERB'), Token(lemma='host', pos='VERB'), Token(lemma='want', pos='VERB'), Token(lemma='do', pos='VERB')]
2948	none	['advice']	It's ok	Not hosting an event if you don't want to.	3.0	not allowing my sister to host her kid's birthday party at my house	It is OK to decline hosting an event if you don't want to do it.	[Token(lemma='host', pos='VERB'), Token(lemma='want', pos='VERB')]
2949	none	['advice']	It's good	letting people know information about an event ahead of time.	3.0	letting my girlfriend know that her family members will be at the same party	It's good to let people know information about an event ahead of time.	[Token(lemma='let', pos='VERB'), Token(lemma='know', pos='VERB')]
2950	none	['social-norms']	It's good	letting people know information about an event ahead of time.	3.0	letting my girlfriend know that her family members will be at the same party	It's good to let people know information about an event ahead of time.	[Token(lemma='let', pos='VERB'), Token(lemma='know', pos='VERB')]
2951	none	['advice']	{}	You may regret not telling someone how you feel.	False	telling a girl that I like her, especially now when she's about to get into a relationship with someone else	You may regret not telling someone how you feel.	[Token(lemma='regret', pos='VERB'), Token(lemma='tell', pos='VERB'), Token(lemma='feel', pos='VERB')]
2952	none	['advice']	You may regret it	not telling someone how you feel.	2.0	telling a girl that I like her, especially now when she's about to get into a relationship with someone else	You may regret not telling someone how you feel.	[Token(lemma='tell', pos='VERB'), Token(lemma='feel', pos='VERB')]
2953	none	['advice']	It is acceptable	cutting off friendships for valid reasons.	3.0	getting really Sick of my friend	It is acceptable to cut off friendships for valid reasons.	[Token(lemma='cut', pos='VERB')]
2954	none	['social-norms']	It is acceptable	cutting off friendships for valid reasons.	3.0	getting really Sick of my friend	It is acceptable to cut off friendships for valid reasons.	[Token(lemma='cut', pos='VERB')]
2955	none	['advice']	It's bad	withdrawing socially.	3.0	withdrawing in a deliberate attempt to 'punish' my friends	It's bad to withdraw socially.	[Token(lemma='withdraw', pos='VERB')]
2956	none	['social-norms', 'advice']	bad	withdrawing socially.	3.0	withdrawing in a deliberate attempt to 'punish' my friends	It's bad to withdraw socially.	[Token(lemma='withdraw', pos='VERB')]
2957	none	['morality-ethics']	It's bad	trying to punish your friends.	3.0	withdrawing in a deliberate attempt to 'punish' my friends	It's bad to try to punish your friends.	[Token(lemma='try', pos='VERB'), Token(lemma='punish', pos='VERB')]
2958	none	['morality-ethics', 'social-norms']	it's bad	trying to punish your friends.	3.0	withdrawing in a deliberate attempt to 'punish' my friends	It's bad to try to punish your friends.	[Token(lemma='try', pos='VERB'), Token(lemma='punish', pos='VERB')]
2959	none	['social-norms']	you should	being understanding of your significant other's situation	4.0	being mad that my long distance girlfriend didn't text me goodnight after a night getting drunk	You should be understanding of your significant other's situation.	[]
2960	none	['social-norms']	You should	being understanding of your significant other's situation.	3.0	being mad that my long distance girlfriend didn't text me goodnight after a night getting drunk	You should be understanding of your significant other's situation.	[]
2961	none	['social-norms', 'advice']	Is polite	Using BCC emails so replies won't fill the inboxes of everyone on the mailing list.	4.0	using BCC emails	Using BCC emails is polite because replies won't fill the inboxes of everyone on the mailing list.	[Token(lemma='use', pos='VERB'), Token(lemma='fill', pos='VERB')]
2962	none	['social-norms']	polite	Using BCC emails	3.0	using BCC emails	Using BCC emails is polite because replies won't fill the inboxes of everyone on the mailing list.	[Token(lemma='use', pos='VERB')]
2963	none	['social-norms']	it's not okay	ignoring your significant other.	3.0	being mad that my long distance girlfriend didn't text me goodnight after a night getting drunk	It is not okay to ignore your significant other.	[Token(lemma='ignore', pos='VERB')]
2964	none	['advice']	It is not okay	ignoring your significant other.	4.0	being mad that my long distance girlfriend didn't text me goodnight after a night getting drunk	It is not okay to ignore your significant other.	[Token(lemma='ignore', pos='VERB')]
2965	none	['advice']	It is not a good thing	walking away from friendships.	3.0	getting really Sick of my friend	It is not a good thing to walk away from friendships.	[Token(lemma='walk', pos='VERB')]
2966	none	['morality-ethics']	It is not a good thing	walking away from friendships.	2.0	getting really Sick of my friend	It is not a good thing to walk away from friendships.	[Token(lemma='walk', pos='VERB')]
