	split	rot-categorization	rot-judgment	action	action-agree	situation	rot	extracted_actions
982	none	['social-norms']	It's ok	being concerned about a loved one's drinking habits.	4.0	not wanting my bf to drink	It's ok to be concerned about a loved one's drinking habits.	[Token(lemma='love', pos='VERB')]
983	none	['social-norms']	It is expected	adults paying for their things at a party.	3.0	asking adults to pay for themselves at my daughter's birthday party	It is expected that adults will pay for their things at a party.	[Token(lemma='pay', pos='VERB')]
984	none	['social-norms']	it's expected	paying for their things at a party.	1.0	asking adults to pay for themselves at my daughter's birthday party	It is expected that adults will pay for their things at a party.	[Token(lemma='pay', pos='VERB')]
985	none	['morality-ethics']	you should	being there for both your parents in a divorce.	2.0	"taking my dad's ""side"" in the divorce even though he's the one that cheated on my mom"	You should be there for both your parents in a divorce.	[]
986	none	['social-norms']	you should	being there for both your parents in a divorce.	2.0	"taking my dad's ""side"" in the divorce even though he's the one that cheated on my mom"	You should be there for both your parents in a divorce.	[]
987	none	['morality-ethics']	You shouldn't	trying to control your significant other.	4.0	not wanting my bf to drink	You shouldn't try to control your significant other.	[Token(lemma='try', pos='VERB'), Token(lemma='control', pos='VERB')]
988	none	['morality-ethics', 'advice']	shouldn't	trying to control your significant other.	3.0	not wanting my bf to drink	You shouldn't try to control your significant other.	[Token(lemma='try', pos='VERB'), Token(lemma='control', pos='VERB')]
989	none	['morality-ethics', 'social-norms']	It is bad	breaking someones toy.	4.0	breaking a kid's RipStik	It is bad to break someones toy.	[Token(lemma='break', pos='VERB')]
990	none	['social-norms']	It is bad	breaking someones toy.	3.0	breaking a kid's RipStik	It is bad to break someones toy.	[Token(lemma='break', pos='VERB')]
991	none	['social-norms']	it is okay	resting on public transportation.	2.0	sleeping on the shuttle	It is okay to rest on public transportation.	[Token(lemma='rest', pos='VERB')]
992	none	['social-norms']	It is okay	resting on public transportation.	3.0	sleeping on the shuttle	It is okay to rest on public transportation.	[Token(lemma='rest', pos='VERB')]
993	none	['morality-ethics', 'social-norms']	it is expected	apologizing and replacing something you break.	4.0	breaking a kid's RipStik	It is expected you apologize and replace something you break.	[Token(lemma='apologize', pos='VERB'), Token(lemma='replace', pos='VERB'), Token(lemma='break', pos='VERB')]
994	none	['social-norms']	it is expected	apologizing and replacing something you break.	3.0	breaking a kid's RipStik	It is expected you apologize and replace something you break.	[Token(lemma='apologize', pos='VERB'), Token(lemma='replace', pos='VERB'), Token(lemma='break', pos='VERB')]
995	none	['advice']	is important	Compromising in a relationship.	3.0	"ignoring my girlfriend's ""compromise"""	Compromise is important in a relationship.	[Token(lemma='compromise', pos='VERB')]
996	none	['social-norms']	important	Compromising in a relationship.	4.0	"ignoring my girlfriend's ""compromise"""	Compromise is important in a relationship.	[Token(lemma='compromise', pos='VERB')]
997	none	['social-norms']	people should	remaining alert on public transportation.	2.0	sleeping on the shuttle	People should remain alert on public transportation.	[Token(lemma='remain', pos='VERB')]
998	none	['advice']	should	People remaining alert on public transportation.	4.0	sleeping on the shuttle	People should remain alert on public transportation.	[Token(lemma='remain', pos='VERB')]
999	none	['morality-ethics']	you should not	ignoring your partner's wishes.	3.0	"ignoring my girlfriend's ""compromise"""	You should not ignore your partner's wishes.	[Token(lemma='ignore', pos='VERB')]
1000	none	['social-norms']	You  should not	ignoring your partner's wishes.	2.0	"ignoring my girlfriend's ""compromise"""	You should not ignore your partner's wishes.	[Token(lemma='ignore', pos='VERB')]
1001	none	['social-norms']	it's important	being courteous to those around you.	4.0	sleeping on the shuttle	It is important to be courteous to those around you.	[]
1002	none	['social-norms']	it's important	being courteous to those around you.	3.0	sleeping on the shuttle	It is important to be courteous to those around you.	[]
1003	none	['advice']	You should	trying to include your girlfriend in recreational activities.	3.0	not wanting to watch Game of Thrones with my girlfriend	You should try to include your girlfriend in recreational activities.	[Token(lemma='try', pos='VERB'), Token(lemma='include', pos='VERB')]
1004	none	['social-norms']	You should	including your girlfriend in recreational activities	4.0	not wanting to watch Game of Thrones with my girlfriend	You should try to include your girlfriend in recreational activities.	[Token(lemma='include', pos='VERB')]
1005	none	['morality-ethics']	You are not obligated	picking up messes you didn't make.	3.0	not helping a stranger pick up all their change	You are not obligated to pick up messes you didn't make.	[Token(lemma='pick', pos='VERB'), Token(lemma='make', pos='VERB')]
1006	none	['social-norms']	not obligated	picking up messes you didn't make.	3.0	not helping a stranger pick up all their change	You are not obligated to pick up messes you didn't make.	[Token(lemma='pick', pos='VERB'), Token(lemma='make', pos='VERB')]
1007	none	['morality-ethics']	It is rude	telling your partner who they can talk to.	3.0	telling my boyfriend he can't talk to his friend anymore	It is rude to tell your partner who they can talk to.	[Token(lemma='tell', pos='VERB'), Token(lemma='talk', pos='VERB')]
1008	none	['social-norms']	It is rude	telling your partner who they can talk to.	3.0	telling my boyfriend he can't talk to his friend anymore	It is rude to tell your partner who they can talk to.	[Token(lemma='tell', pos='VERB'), Token(lemma='talk', pos='VERB')]
1009	none	['advice']	It's okay	saying you don't want something.	3.0	not wanting my sister to get a second dog	It's okay to say you don't want something.	[Token(lemma='say', pos='VERB'), Token(lemma='want', pos='VERB')]
1010	none	['advice']	It's okay	saying you don't want something.	4.0	not wanting my sister to get a second dog	It's okay to say you don't want something.	[Token(lemma='say', pos='VERB'), Token(lemma='want', pos='VERB')]
1011	none	['social-norms', 'advice']	it's wrong	getting a second dog if you don't want it.	3.0	not wanting my sister to get a second dog	It's wrong to get a second dog if you don't want it.	[Token(lemma='get', pos='VERB'), Token(lemma='want', pos='VERB')]
1012	none	['morality-ethics', 'social-norms']	It's wrong	getting a second dog if you don't want it.	4.0	not wanting my sister to get a second dog	It's wrong to get a second dog if you don't want it.	[Token(lemma='get', pos='VERB'), Token(lemma='want', pos='VERB')]
1013	none	['social-norms', 'advice']	Try	not taking it personally when your boyfriend doesn't want to spend all his free time with you.	False	not wanting to watch Game of Thrones with my girlfriend	Try not to take it personally if your boyfriend doesn't want to spend all his free time with you.	[Token(lemma='take', pos='VERB'), Token(lemma='want', pos='VERB'), Token(lemma='spend', pos='VERB')]
1014	none	['advice']	try not to	take it personally if your boyfriend doesn't want to spend all his free time with you.	False	not wanting to watch Game of Thrones with my girlfriend	Try not to take it personally if your boyfriend doesn't want to spend all his free time with you.	[Token(lemma='take', pos='VERB'), Token(lemma='want', pos='VERB'), Token(lemma='spend', pos='VERB')]
1015	none	['morality-ethics', 'social-norms']	It's not okay	ending other people's friendships.	3.0	telling my boyfriend he can't talk to his friend anymore	It is not okay to end other people's friendships.	[Token(lemma='end', pos='VERB')]
1016	none	['morality-ethics', 'social-norms']	It is not okay	ending other people's friendships.	3.0	telling my boyfriend he can't talk to his friend anymore	It is not okay to end other people's friendships.	[Token(lemma='end', pos='VERB')]
1017	none	['morality-ethics', 'social-norms']	it is kind	helping someone even if you don't know them.	4.0	not helping a stranger pick up all their change	It is kind to help someone, even if you don't know them.	[Token(lemma='help', pos='VERB'), Token(lemma='know', pos='VERB')]
1018	none	['social-norms']	it is kind	helping someone, even if you don't know them	4.0	not helping a stranger pick up all their change	It is kind to help someone, even if you don't know them.	[Token(lemma='help', pos='VERB'), Token(lemma='know', pos='VERB')]
1019	none	['description']	Don't	feel like you need to watch a streamed program together to talk about it.	2.0	not wanting to watch Game of Thrones with my girlfriend	Don't feel like you need to watch a streamed program together to talk about it.	[Token(lemma='feel', pos='VERB'), Token(lemma='need', pos='VERB'), Token(lemma='watch', pos='VERB'), Token(lemma='stream', pos='VERB'), Token(lemma='talk', pos='VERB')]
1020	none	['social-norms']	don't feel like you need to	watching a streamed program together to talk about it	2.0	not wanting to watch Game of Thrones with my girlfriend	Don't feel like you need to watch a streamed program together to talk about it.	[Token(lemma='watch', pos='VERB'), Token(lemma='stream', pos='VERB'), Token(lemma='talk', pos='VERB')]
1021	none	['social-norms']	you should	trying not to get involved in the business of family members.	3.0	not wanting my sister to get a second dog	You should try not to get involved in the business of family members.	[Token(lemma='try', pos='VERB'), Token(lemma='involve', pos='VERB')]
1022	none	['social-norms', 'advice']	shouldn't	getting involved in the business of family members.	2.0	not wanting my sister to get a second dog	You should try not to get involved in the business of family members.	[Token(lemma='get', pos='VERB'), Token(lemma='involve', pos='VERB')]
1023	none	['morality-ethics']	should	supporting your partner	4.0	telling my boyfriend he can't talk to his friend anymore	You should support your partner.	[Token(lemma='support', pos='VERB')]
1024	none	['social-norms']	should	supporting your partner	3.0	telling my boyfriend he can't talk to his friend anymore	You should support your partner.	[Token(lemma='support', pos='VERB')]
1025	none	['advice']	{}	If you want to avoid hurt feelings, offer to watch your favorite programs with your girlfriend.	False	not wanting to watch Game of Thrones with my girlfriend	If you want to avoid hurt feelings, offer to watch your favorite programs with your girlfriend.	[Token(lemma='want', pos='VERB'), Token(lemma='avoid', pos='VERB'), Token(lemma='offer', pos='VERB'), Token(lemma='watch', pos='VERB')]
1026	none	['advice']	you should	offering to watch your favorite programs with your girlfriend.	3.0	not wanting to watch Game of Thrones with my girlfriend	If you want to avoid hurt feelings, offer to watch your favorite programs with your girlfriend.	[Token(lemma='offer', pos='VERB'), Token(lemma='watch', pos='VERB')]
1027	none	['advice']	Rude	not doing someone a favor	3.0	not letting my temporarily homeless brother stay with me and my girlfriend for a week	If it's easy to do someone a favor, you would be rude not to do it.	[Token(lemma='do', pos='VERB')]
1028	none	['social-norms']	It is rude	Not doing an easy favorite for someone.	3.0	not letting my temporarily homeless brother stay with me and my girlfriend for a week	If it's easy to do someone a favor, you would be rude not to do it.	[Token(lemma='do', pos='VERB')]
1029	none	['advice']	You should	always using your headlights so you can see and others can see you in the dark.	4.0	using led headlights	You should always use your headlights so you can see and others can see you in the dark.	[Token(lemma='use', pos='VERB'), Token(lemma='see', pos='VERB'), Token(lemma='see', pos='VERB')]
1030	none	['advice']	should	always using your headlights so you can see and others can see you in the dark.	4.0	using led headlights	You should always use your headlights so you can see and others can see you in the dark.	[Token(lemma='use', pos='VERB'), Token(lemma='see', pos='VERB'), Token(lemma='see', pos='VERB')]
1031	none	['morality-ethics']	it is rude	walking past someone that needs help	3.0	not helping a stranger pick up all their change	It is rude to walk past someone that needs help.	[Token(lemma='walk', pos='VERB'), Token(lemma='need', pos='VERB')]
1032	none	['morality-ethics']	it's rude	walking past someone that needs help.	3.0	not helping a stranger pick up all their change	It is rude to walk past someone that needs help.	[Token(lemma='walk', pos='VERB'), Token(lemma='need', pos='VERB')]
1033	none	['advice']	it's good	Using led headlights because they are better for the environment.	3.0	using led headlights	It's good to use led headlights because they are better for the environment.	[Token(lemma='use', pos='VERB'), Token(lemma='lead', pos='VERB')]
1034	none	['morality-ethics']	it's good	using led headlights because they are better for the environment.	2.0	using led headlights	It's good to use led headlights because they are better for the environment.	[Token(lemma='use', pos='VERB'), Token(lemma='lead', pos='VERB')]
1035	none	['social-norms']	it's okay	not liking your significant other's friends.	False	telling my boyfriend he can't talk to his friend anymore	It is okay to not like your significant other's friends.	[Token(lemma='like', pos='VERB')]
1036	none	['morality-ethics']	it is okay	not liking your significant other's friends.	3.0	telling my boyfriend he can't talk to his friend anymore	It is okay to not like your significant other's friends.	[Token(lemma='like', pos='VERB')]
1037	none	['description']	It is hurtful	reporting your family to the authorities.	False	reporting my brother to child protective services	It is hurtful to report your family to the authorities.	[Token(lemma='report', pos='VERB')]
1038	none	['morality-ethics']	It is hurtful	reporting your family to the authorities.	2.0	reporting my brother to child protective services	It is hurtful to report your family to the authorities.	[Token(lemma='report', pos='VERB')]
1039	none	['social-norms']	It's good	calling people out when they deserve it.	2.0	calling a family member out	It's good to call people out when they deserve it.	[Token(lemma='call', pos='VERB'), Token(lemma='deserve', pos='VERB')]
1040	none	['morality-ethics', 'advice']	it's good	calling people out when they deserve it.	4.0	calling a family member out	It's good to call people out when they deserve it.	[Token(lemma='call', pos='VERB'), Token(lemma='deserve', pos='VERB')]
1041	none	['morality-ethics']	it's OK	excluding others when watching TV programs	2.0	not wanting to watch Game of Thrones with my girlfriend	It's OK to exclude others when watching TV programs.	[Token(lemma='exclude', pos='VERB'), Token(lemma='watch', pos='VERB')]
1042	none	['morality-ethics', 'social-norms']	it's ok	excluding others when watching TV programs	3.0	not wanting to watch Game of Thrones with my girlfriend	It's OK to exclude others when watching TV programs.	[Token(lemma='exclude', pos='VERB'), Token(lemma='watch', pos='VERB')]
1043	none	['advice']	Its Okay	Wanting to move to a new place from a place you rent.	3.0	not wanting to renew the lease	It's okay to want to move to a new place from a place you rent.	[Token(lemma='want', pos='VERB'), Token(lemma='move', pos='VERB'), Token(lemma='rent', pos='VERB')]
1044	none	['social-norms']	It's okay	wanting to move to a new place from a place you rent.	3.0	not wanting to renew the lease	It's okay to want to move to a new place from a place you rent.	[Token(lemma='want', pos='VERB'), Token(lemma='move', pos='VERB'), Token(lemma='rent', pos='VERB')]
1045	none	['social-norms']	It is good	sharing things with friends.	3.0	not wanting to share stuff with my friends	It is good to share things with friends.	[Token(lemma='share', pos='VERB')]
1046	none	['social-norms']	it's good	sharing things with friends.	4.0	not wanting to share stuff with my friends	It is good to share things with friends.	[Token(lemma='share', pos='VERB')]
1047	none	['morality-ethics']	it is expected	turning in family if they commit a crime.	3.0	reporting my brother to child protective services	It is expected to turn in family if they commit a crime.	[Token(lemma='turn', pos='VERB'), Token(lemma='commit', pos='VERB')]
1048	none	['morality-ethics', 'social-norms']	It is expected	turning in family when they commit a crime.	3.0	reporting my brother to child protective services	It is expected to turn in family if they commit a crime.	[Token(lemma='turn', pos='VERB'), Token(lemma='commit', pos='VERB')]
1049	none	['morality-ethics']	it's not okay	moving out of somewhere you were expected to live in and pay for.	3.0	not wanting to renew the lease	It's not okay to move out of somewhere you were expected to live in and pay for.	[Token(lemma='move', pos='VERB'), Token(lemma='expect', pos='VERB'), Token(lemma='live', pos='VERB'), Token(lemma='pay', pos='VERB')]
1050	none	['morality-ethics']	it's not okay	moving out of somewhere you were expected to live in and pay for.	3.0	not wanting to renew the lease	It's not okay to move out of somewhere you were expected to live in and pay for.	[Token(lemma='move', pos='VERB'), Token(lemma='expect', pos='VERB'), Token(lemma='live', pos='VERB'), Token(lemma='pay', pos='VERB')]
1051	none	['morality-ethics', 'social-norms']	It is rude	ditching plans with a friend.	3.0	saying I could get a college apartment room with a friend and her friend, and then ditching	It is rude to ditch plans with a friend.	[Token(lemma='ditch', pos='VERB')]
1052	none	['morality-ethics']	rude	ditching plans with a friend.	4.0	saying I could get a college apartment room with a friend and her friend, and then ditching	It is rude to ditch plans with a friend.	[Token(lemma='ditch', pos='VERB')]
1053	none	['morality-ethics', 'advice']	You should not	entering into a relationship with children when you do not accept the children.	3.0	resenting my partner's teenage daughter	You should not enter into a relationship with children involved unless you accept the children too.	[Token(lemma='enter', pos='VERB'), Token(lemma='accept', pos='VERB')]
1054	none	['advice']	should not	entering into a relationship with children involved unless you accept the children too.	3.0	resenting my partner's teenage daughter	You should not enter into a relationship with children involved unless you accept the children too.	[Token(lemma='enter', pos='VERB'), Token(lemma='involve', pos='VERB'), Token(lemma='accept', pos='VERB')]
1055	none	['morality-ethics', 'advice']	It's good	telling someone the truth if they are being cheated on.	3.0	not telling someone they are being cheated on	It is good to tell someone the truth if they are being cheated on.	[Token(lemma='tell', pos='VERB'), Token(lemma='cheat', pos='VERB')]
1056	none	['morality-ethics']	It is good	telling someone the truth if they are being cheated on.	3.0	not telling someone they are being cheated on	It is good to tell someone the truth if they are being cheated on.	[Token(lemma='tell', pos='VERB'), Token(lemma='cheat', pos='VERB')]
1057	none	['social-norms']	It's okay	wanting a change from where you are living.	4.0	not wanting to renew the lease	It's okay to want a change from where you are living.	[Token(lemma='want', pos='VERB'), Token(lemma='live', pos='VERB')]
1058	none	['description']	It's okay	wanting a change from where you are living.	4.0	not wanting to renew the lease	It's okay to want a change from where you are living.	[Token(lemma='want', pos='VERB'), Token(lemma='live', pos='VERB')]
1059	none	['morality-ethics']	shouldn't	letting people down  that depend on you.	4.0	saying I could get a college apartment room with a friend and her friend, and then ditching	You should not let down people that depend on you.	[Token(lemma='let', pos='VERB'), Token(lemma='depend', pos='VERB')]
1060	none	['social-norms', 'advice']	you should not	letting down people that depend on you.	0.0	saying I could get a college apartment room with a friend and her friend, and then ditching	You should not let down people that depend on you.	[Token(lemma='let', pos='VERB'), Token(lemma='depend', pos='VERB')]
1061	none	['description']	shouldn't have to	dealing with the mental problems of others.	3.0	not being able to deal with my gf's stress, anxiety, and depression anymore	You shouldn't have to deal with the mental problems of others.	[Token(lemma='deal', pos='VERB')]
1062	none	['social-norms']	you shouldn't	having to deal with the mental problems of others.	3.0	not being able to deal with my gf's stress, anxiety, and depression anymore	You shouldn't have to deal with the mental problems of others.	[Token(lemma='have', pos='VERB'), Token(lemma='deal', pos='VERB')]
1063	none	['advice']	it is okay	asking for help.	3.0	being mad at my friends for not helping me	It is okay to ask for help.	[Token(lemma='ask', pos='VERB')]
1064	none	['advice']	It is okay	asking for help.	3.0	being mad at my friends for not helping me	It is okay to ask for help.	[Token(lemma='ask', pos='VERB')]
1065	none	['social-norms']	understandable	wanting your partner to be considerate of your medical conditions.	4.0	wanting my so to take a shower after handling animals? I have terrible eczema	It's understandable to want your partner to be considerate of your medical conditions.	[Token(lemma='want', pos='VERB')]
1066	none	['morality-ethics', 'social-norms']	It's understandable	wanting your partner to be considerate of your medical conditions.	3.0	wanting my so to take a shower after handling animals? I have terrible eczema	It's understandable to want your partner to be considerate of your medical conditions.	[Token(lemma='want', pos='VERB')]
1067	none	['morality-ethics']	It is wrong	resenting a child.	3.0	resenting my partner's teenage daughter	It is wrong to resent a child.	[Token(lemma='resent', pos='VERB')]
1068	none	['morality-ethics']	it is wrong	resenting a child	3.0	resenting my partner's teenage daughter	It is wrong to resent a child.	[Token(lemma='resent', pos='VERB')]
1069	none	['advice']	it's important	communicating in a friendship.	3.0	wanting my best friend to talk to me before dating my ex	Communication is important in a friendship.	[Token(lemma='communicate', pos='VERB')]
1070	none	['social-norms']	important	Communicating in a friendship.	4.0	wanting my best friend to talk to me before dating my ex	Communication is important in a friendship.	[Token(lemma='communicate', pos='VERB')]
1071	none	['advice']	Try to not let your negative emotions	poisoning your relationships.	3.0	not being able to deal with my gf's stress, anxiety, and depression anymore	Try to not let your negative emotions poison your relationships.	[Token(lemma='poison', pos='VERB')]
1072	none		{}	Try to not let your negative emotions poison your relationships.	False	not being able to deal with my gf's stress, anxiety, and depression anymore	Try to not let your negative emotions poison your relationships.	[Token(lemma='try', pos='VERB'), Token(lemma='let', pos='VERB'), Token(lemma='poison', pos='VERB')]
1073	none	['social-norms']	it is good	telling friends your expectations	4.0	wanting my best friend to talk to me before dating my ex	It is good to tell friends your expectations.	[Token(lemma='tell', pos='VERB')]
1074	none	['advice']	it's good	telling friends your expectations.	3.0	wanting my best friend to talk to me before dating my ex	It is good to tell friends your expectations.	[Token(lemma='tell', pos='VERB')]
1075	none	['description']	{}	You should remember people have busy lives.	False	being mad at my friends for not helping me	You should remember people have busy lives.	[Token(lemma='remember', pos='VERB'), Token(lemma='have', pos='VERB')]
1076	none	['social-norms', 'advice']	You should	remembering people have busy lives.	4.0	being mad at my friends for not helping me	You should remember people have busy lives.	[Token(lemma='remember', pos='VERB'), Token(lemma='have', pos='VERB')]
1077	none	['morality-ethics', 'social-norms']	Endeavor to be	understanding of the problems of others.	4.0	not being able to deal with my gf's stress, anxiety, and depression anymore	Endeavor to be understanding of the problems of others.	[]
1078	none	['morality-ethics', 'advice']	Endeavor to	being understanding of the problems of others.	4.0	not being able to deal with my gf's stress, anxiety, and depression anymore	Endeavor to be understanding of the problems of others.	[]
1079	none	['description']	It is okay	feeling resentment to those causing issues in a relationship.	False	resenting my partner's teenage daughter	It is okay to feel resentment to those causing issues in a relationship.	[Token(lemma='feel', pos='VERB'), Token(lemma='cause', pos='VERB')]
1080	none	['morality-ethics']	it's okay	feeling resentment to those causing issues in a relationship.	2.0	resenting my partner's teenage daughter	It is okay to feel resentment to those causing issues in a relationship.	[Token(lemma='feel', pos='VERB'), Token(lemma='cause', pos='VERB')]
1081	none	['social-norms', 'advice']	Is okay	celebrating holidays.	3.0	going out for new years	It is okay to celebrate holidays.	[Token(lemma='celebrate', pos='VERB')]
1082	none	['social-norms']	It is okay	celebrating holidays.	4.0	going out for new years	It is okay to celebrate holidays.	[Token(lemma='celebrate', pos='VERB')]
