	split	rot-categorization	rot-judgment	action	action-agree	situation	rot	extracted_actions
0	none	['morality-ethics']	It is unkind	hiding someone else's things.	4.0	hiding my controller	It is unkind to hide someone else's things.	[Token(lemma='hide', pos='VERB')]
1	none	['morality-ethics']	It is unkind	hiding someone else's things.	3.0	hiding my controller	It is unkind to hide someone else's things.	[Token(lemma='hide', pos='VERB')]
2	none	['morality-ethics']	it's wrong	being mad at a family member simply because they forgot your birthday.	2.0	being annoyed that my birthday was snubbed by a family member	It's wrong to be mad at a family member simply because they forgot your birthday.	[Token(lemma='forget', pos='VERB')]
3	none	['social-norms']	It's wrong	being mad at a family member simply because they forgot your birthday.	1.0	being annoyed that my birthday was snubbed by a family member	It's wrong to be mad at a family member simply because they forgot your birthday.	[Token(lemma='forget', pos='VERB')]
4	none	['advice']	You should	forgiving family members for forgetting things important to you.	3.0	being annoyed that my birthday was snubbed by a family member	You should forgive family members for forgetting things important to you.	[Token(lemma='forgive', pos='VERB'), Token(lemma='forget', pos='VERB')]
5	none	['advice']	you should	forgiving family members for forgetting things important to you.	3.0	being annoyed that my birthday was snubbed by a family member	You should forgive family members for forgetting things important to you.	[Token(lemma='forgive', pos='VERB'), Token(lemma='forget', pos='VERB')]
6	none	['social-norms']	It is stingy	hiding your things from others.	3.0	hiding my controller	It is stingy to hide your things from others.	[Token(lemma='hide', pos='VERB')]
7	none	['morality-ethics']	stingy	hiding your things from others.	2.0	hiding my controller	It is stingy to hide your things from others.	[Token(lemma='hide', pos='VERB')]
8	none	['advice']	It is smart	hiding your things to keep them safe.	4.0	hiding my controller	It is smart to hide your things to keep them safe.	[Token(lemma='hide', pos='VERB'), Token(lemma='keep', pos='VERB')]
9	none	['advice']	it is smart	hiding your things to keep them safe.	3.0	hiding my controller	It is smart to hide your things to keep them safe.	[Token(lemma='hide', pos='VERB'), Token(lemma='keep', pos='VERB')]
10	none	['social-norms']	It is okay	enjoying games.	False	going to the game tomorrow	It is okay to enjoy games.	[Token(lemma='enjoy', pos='VERB')]
11	none	['description']	it's okay	to enjoy games.	False	going to the game tomorrow	It is okay to enjoy games.	[Token(lemma='enjoy', pos='VERB')]
12	none	['morality-ethics']	it's enjoyable	getting revenge on supervisors.	2.0	ratting out my supervisor	People sometimes enjoy getting revenge on their supervisors.	[Token(lemma='get', pos='VERB')]
13	none	['social-norms', 'advice']	it is important	not ignoring responsibilities for games.	3.0	going to the game tomorrow	It is important to not ignore responsibilities for games.	[Token(lemma='ignore', pos='VERB')]
14	none	['morality-ethics', 'social-norms']	It is important	Not ignoring responsibilities for games.	3.0	going to the game tomorrow	It is important to not ignore responsibilities for games.	[Token(lemma='ignore', pos='VERB')]
15	none	['morality-ethics', 'social-norms']	immature	tattling on people.	3.0	ratting out my supervisor	It can be seen as immature to tattle on people.	[Token(lemma='tattle', pos='VERB')]
16	none	['morality-ethics', 'social-norms']	It can be seen as immature	tattling on people.	3.0	ratting out my supervisor	It can be seen as immature to tattle on people.	[Token(lemma='tattle', pos='VERB')]
17	none	['social-norms']	It is expected	sharing items of clothing with your siblings sometimes.	4.0	borrowing my brothers coat from time to time	It is expected that you share items of clothing with your siblings sometimes.	[Token(lemma='share', pos='VERB')]
18	none	['social-norms']	It is expected	sharing items of clothing with your siblings sometimes.	3.0	borrowing my brothers coat from time to time	It is expected that you share items of clothing with your siblings sometimes.	[Token(lemma='share', pos='VERB')]
19	none	['social-norms', 'advice']	You should	being open to fact that other people have different taste in music.	4.0	commenting that unfamiliar indie bands at artists were the best types of music to listen to	You should be open to fact that other people have different taste in music.	[Token(lemma='have', pos='VERB')]
20	none	['social-norms']	It is okay	not wanting to be friends with someone.	3.0	ending a friendship with a girl I have romantic feelings for after being rejected	It is okay to not want to be friends with someone.	[Token(lemma='want', pos='VERB')]
21	none	['advice']	it's okay	not wanting to be friends with someone.	2.0	ending a friendship with a girl I have romantic feelings for after being rejected	It is okay to not want to be friends with someone.	[Token(lemma='want', pos='VERB')]
22	none	['social-norms']	It is rude	telling someone how they should spend their money.	3.0	wanting to choose the car that my mum buys for me	It is rude to tell someone how they should spend their money.	[Token(lemma='tell', pos='VERB'), Token(lemma='spend', pos='VERB')]
23	none	['social-norms']	It is rude	telling someone how they should spend their money.	4.0	wanting to choose the car that my mum buys for me	It is rude to tell someone how they should spend their money.	[Token(lemma='tell', pos='VERB'), Token(lemma='spend', pos='VERB')]
24	none	['advice']	It is selfish	thinking that your opinions of music are more right than others.	2.0	commenting that unfamiliar indie bands at artists were the best types of music to listen to	It is selfish to think that your opinions of music are more right than others.	[Token(lemma='think', pos='VERB')]
25	none	['social-norms']	It is selfish	thinking that your opinions of music are more right than others.	3.0	commenting that unfamiliar indie bands at artists were the best types of music to listen to	It is selfish to think that your opinions of music are more right than others.	[Token(lemma='think', pos='VERB')]
26	none	['advice', 'description']	it's OK	taking whomever you want to your prom.	3.0	not asking my best friend to prom even though she wanted me to	It's OK to take whomever you want to your prom.	[Token(lemma='take', pos='VERB'), Token(lemma='want', pos='VERB')]
27	none	['advice']	it's ok	taking whomever you want to your prom.	4.0	not asking my best friend to prom even though she wanted me to	It's OK to take whomever you want to your prom.	[Token(lemma='take', pos='VERB'), Token(lemma='want', pos='VERB')]
28	none	['social-norms']	It is expected for a competitive person	trying to get a friend to surrender in a game.	1.0	arguing for my friend to surrender in a game before the Game is done	It is expected for a competitive person to try to get a friend to surrender in a game.	[Token(lemma='try', pos='VERB'), Token(lemma='get', pos='VERB'), Token(lemma='surrender', pos='VERB')]
29	none	['social-norms']	It is expected	a competitive person trying to get a friend to surrender in a game.	3.0	arguing for my friend to surrender in a game before the Game is done	It is expected for a competitive person to try to get a friend to surrender in a game.	[Token(lemma='try', pos='VERB'), Token(lemma='get', pos='VERB'), Token(lemma='surrender', pos='VERB')]
30	none	['social-norms']	It is OK	picking out a gift for yourself if you are asked to.	4.0	wanting to choose the car that my mum buys for me	It is OK to pick out a gift for yourself if you are asked to.	[Token(lemma='pick', pos='VERB'), Token(lemma='ask', pos='VERB')]
31	none	['social-norms']	allowed	expecting others others to respect your property.	4.0	being mad at my wife for neglecting/ willfully trashing my cars	You are allowed to expect others to respect your property.	[Token(lemma='expect', pos='VERB'), Token(lemma='respect', pos='VERB')]
32	none	['advice']	Allowed	expecting others to respect your property.	False	being mad at my wife for neglecting/ willfully trashing my cars	You are allowed to expect others to respect your property.	[Token(lemma='expect', pos='VERB'), Token(lemma='respect', pos='VERB')]
33	none	['social-norms']	It is ungrateful	dictating what gift someone should buy you.	3.0	wanting to choose the car that my mum buys for me	It is ungrateful to dictate what gift someone should buy you.	[Token(lemma='dictate', pos='VERB'), Token(lemma='buy', pos='VERB')]
34	none	['morality-ethics']	it's ungrateful	dictating what gift someone should buy you.	2.0	wanting to choose the car that my mum buys for me	It is ungrateful to dictate what gift someone should buy you.	[Token(lemma='dictate', pos='VERB'), Token(lemma='buy', pos='VERB')]
35	none	['social-norms']	It is expected	wanting a say in a big purchase even if someone else is paying.	2.0	wanting to choose the car that my mum buys for me	It is expected that you want a say in a big purchase even if someone else is paying.	[Token(lemma='want', pos='VERB'), Token(lemma='pay', pos='VERB')]
36	none	['social-norms']	it's expected	asking someone you're dating to prom.	3.0	not asking my best friend to prom even though she wanted me to	It's expected that you ask someone you're dating to prom.	[Token(lemma='ask', pos='VERB'), Token(lemma='date', pos='VERB')]
37	none	['social-norms']	it's expected	asking someone you're dating to prom.	3.0	not asking my best friend to prom even though she wanted me to	It's expected that you ask someone you're dating to prom.	[Token(lemma='ask', pos='VERB'), Token(lemma='date', pos='VERB')]
38	none	['morality-ethics']	should	not angering your wife.	3.0	being mad at my wife for neglecting/ willfully trashing my cars	You should not anger your wife.	[Token(lemma='anger', pos='VERB')]
39	none	['morality-ethics']	It is hurtful	ignoring friends.	4.0	leaving a friend out of a Hearts of Iron game	It is hurtful to ignore friends.	[Token(lemma='ignore', pos='VERB')]
40	none	['morality-ethics']	It is hurtful	ignoring friends.	3.0	leaving a friend out of a Hearts of Iron game	It is hurtful to ignore friends.	[Token(lemma='ignore', pos='VERB')]
41	none	['morality-ethics']	It is okay	not inviting people that you do not want to spend time with.	3.0	leaving a friend out of a Hearts of Iron game	It is okay to not invite people that you do not want to spend time with.	[Token(lemma='invite', pos='VERB'), Token(lemma='want', pos='VERB'), Token(lemma='spend', pos='VERB')]
42	none	['description']	{}	Some people are messy.	False	being mad at my wife for neglecting/ willfully trashing my cars	Some people are messy.	[]
43	none	['description']	expected	people being messy.	False	being mad at my wife for neglecting/ willfully trashing my cars	Some people are messy.	[]
44	none	['social-norms']	It's good	a husband and wife living together	4.0	moving out of my in-laws' without my husband	It is good for a husband and wife to live together	[Token(lemma='live', pos='VERB')]
45	none	['social-norms']	it is good	living together with your husband or wife	4.0	moving out of my in-laws' without my husband	It is good for a husband and wife to live together	[Token(lemma='live', pos='VERB')]
46	none	['description']	it's fine	being angry about something that is disgusting.	3.0	trying to express that it's extremely infuriating when grown adult men urinate on public toilet seats with a picture of someone urinating in the next stall	It's fine to be angry about something that is disgusting.	[]
47	none	['morality-ethics', 'social-norms']	It's fine	being angry about something that is disgusting.	False	trying to express that it's extremely infuriating when grown adult men urinate on public toilet seats with a picture of someone urinating in the next stall	It's fine to be angry about something that is disgusting.	[]
48	none	['advice']	should	using your existing contacts for networking.	4.0	contacting old customers in hopes to bring them to my new place of employment	You should use your existing contacts for networking.	[Token(lemma='use', pos='VERB'), Token(lemma='exist', pos='VERB')]
49	none	['advice']	You should	using your existing contacts for networking.	3.0	contacting old customers in hopes to bring them to my new place of employment	You should use your existing contacts for networking.	[Token(lemma='use', pos='VERB'), Token(lemma='exist', pos='VERB')]
50	none	['morality-ethics']	morally wrong	neglecting an animal	4.0	reporting my brother-in-law for animal neglect	Animal neglect is morally wrong	[Token(lemma='neglect', pos='VERB')]
51	none	['morality-ethics']	Its morally wrong	neglecting animals	4.0	reporting my brother-in-law for animal neglect	Animal neglect is morally wrong	[Token(lemma='neglect', pos='VERB')]
52	none	['advice']	should	trying to understand why others do things you may not like.	3.0	trying to express that it's extremely infuriating when grown adult men urinate on public toilet seats with a picture of someone urinating in the next stall	You should try to understand why others do things you may not like.	[Token(lemma='try', pos='VERB'), Token(lemma='understand', pos='VERB'), Token(lemma='do', pos='VERB'), Token(lemma='like', pos='VERB')]
53	none	['social-norms']	You should	trying to understand why others do things you may not like.	2.0	trying to express that it's extremely infuriating when grown adult men urinate on public toilet seats with a picture of someone urinating in the next stall	You should try to understand why others do things you may not like.	[Token(lemma='try', pos='VERB'), Token(lemma='understand', pos='VERB'), Token(lemma='do', pos='VERB'), Token(lemma='like', pos='VERB')]
54	none	['advice']	you should not be angry	people doing disgusting things	3.0	trying to express that it's extremely infuriating when grown adult men urinate on public toilet seats with a picture of someone urinating in the next stall	You should not be angry about disgusting things since they can't hurt you.	[Token(lemma='do', pos='VERB')]
55	none	['morality-ethics', 'social-norms']	It's rude	reporting family members to the authorities	2.0	reporting my brother-in-law for animal neglect	It's rude to report family members to the authorities	[Token(lemma='report', pos='VERB')]
56	none	['advice']	its rude	reporting family members to the authorities	2.0	reporting my brother-in-law for animal neglect	It's rude to report family members to the authorities	[Token(lemma='report', pos='VERB')]
57	none	['morality-ethics', 'social-norms']	It is frowned upon	taking customers from other businesses.	2.0	contacting old customers in hopes to bring them to my new place of employment	It is frowned upon to take customers from other businesses.	[Token(lemma='take', pos='VERB')]
58	none	['social-norms']	It is frowned upon	taking customers from other businesses.	4.0	contacting old customers in hopes to bring them to my new place of employment	It is frowned upon to take customers from other businesses.	[Token(lemma='take', pos='VERB')]
59	none	['social-norms']	It is OK	not loaning out your car to someone who drives bad.	3.0	refusing my boyfriend to drive my car after seeing how he drives his	It is OK not to loan out your car to someone who drives bad.	[Token(lemma='loan', pos='VERB'), Token(lemma='drive', pos='VERB')]
60	none	['social-norms', 'advice']	it's ok	not loaning out your car to someone who drives bad.	4.0	refusing my boyfriend to drive my car after seeing how he drives his	It is OK not to loan out your car to someone who drives bad.	[Token(lemma='loan', pos='VERB'), Token(lemma='drive', pos='VERB')]
61	none	['description']	{}	People usually remember good or bad customer service.	False	contacting old customers in hopes to bring them to my new place of employment	People usually remember good or bad customer service.	[Token(lemma='remember', pos='VERB')]
62	none	['social-norms']	{}	People usually remember good or bad customer service.	False	contacting old customers in hopes to bring them to my new place of employment	People usually remember good or bad customer service.	[Token(lemma='remember', pos='VERB')]
63	none	['social-norms']	it is bad	using a roommates items	2.0	telling my roommate to stop using my body Wash	It is bad to use a roommates items because that is stealing from them.	[Token(lemma='use', pos='VERB')]
64	none	['morality-ethics', 'social-norms']	it's bad	using a roommates items in a way that is like stealing from them.	4.0	telling my roommate to stop using my body Wash	It is bad to use a roommates items because that is stealing from them.	[Token(lemma='use', pos='VERB'), Token(lemma='steal', pos='VERB')]
65	none	['social-norms']	expected	asking for permission before using something that is not yours.	3.0	telling my roommate to stop using my body Wash	It is expected to ask for permission before using something that is not yours.	[Token(lemma='ask', pos='VERB'), Token(lemma='use', pos='VERB')]
66	none	['social-norms']	it's expected	asking for permission before using something that is not yours.	4.0	telling my roommate to stop using my body Wash	It is expected to ask for permission before using something that is not yours.	[Token(lemma='ask', pos='VERB'), Token(lemma='use', pos='VERB')]
67	none	['social-norms']	it's rude	ignoring people's birthdays.	4.0	being upset that my bf missed my birthday cake	It is rude to ignore people's birthdays.	[Token(lemma='ignore', pos='VERB')]
68	none	['advice']	It's rude	ignoring people's birthdays.	2.0	being upset that my bf missed my birthday cake	It is rude to ignore people's birthdays.	[Token(lemma='ignore', pos='VERB')]
69	none	['social-norms', 'advice']	It is okay	Being hurt by others ignoring what is important to you	False	being upset that my bf missed my birthday cake	It is okay to be hurt by others ignoring what is important to you.	[Token(lemma='hurt', pos='VERB'), Token(lemma='ignore', pos='VERB')]
70	none	['social-norms', 'advice']	it's okay	being hurt by others ignoring what is important to you.	False	being upset that my bf missed my birthday cake	It is okay to be hurt by others ignoring what is important to you.	[Token(lemma='hurt', pos='VERB'), Token(lemma='ignore', pos='VERB')]
71	none	['social-norms']	It is okay	telling someone your true feelings.	3.0	being hurt by my ex and what he said and telling him my true feelings	It is okay to tell someone your true feelings.	[Token(lemma='tell', pos='VERB')]
72	none	['social-norms']	It is okay	telling someone your true feelings.	3.0	being hurt by my ex and what he said and telling him my true feelings	It is okay to tell someone your true feelings.	[Token(lemma='tell', pos='VERB')]
73	none	['morality-ethics', 'social-norms']	It is expected	not wanting someone else to come into a relationship.	False	not wanting a threesome with my husband	It is expected to not want someone else to come into a relationship.	[Token(lemma='want', pos='VERB'), Token(lemma='come', pos='VERB')]
74	none	['social-norms']	its expected	not wanting someone else to come into a relationship.	4.0	not wanting a threesome with my husband	It is expected to not want someone else to come into a relationship.	[Token(lemma='want', pos='VERB'), Token(lemma='come', pos='VERB')]
75	none	['social-norms', 'advice']	it's good	not letting reckless drivers use your car.	4.0	refusing my boyfriend to drive my car after seeing how he drives his	It is good not to let reckless drivers use your car.	[Token(lemma='let', pos='VERB'), Token(lemma='use', pos='VERB')]
76	none	['advice']	It is good	not letting reckless drivers use your car.	4.0	refusing my boyfriend to drive my car after seeing how he drives his	It is good not to let reckless drivers use your car.	[Token(lemma='let', pos='VERB'), Token(lemma='use', pos='VERB')]
77	none	['morality-ethics']	its wrong	Hurting other people's feelings	4.0	being hurt by my ex and what he said and telling him my true feelings	Hurting other people's feelings is wrong.	[Token(lemma='hurt', pos='VERB')]
78	none	['morality-ethics']	is wrong	hurting other people's feelings	4.0	being hurt by my ex and what he said and telling him my true feelings	Hurting other people's feelings is wrong.	[Token(lemma='hurt', pos='VERB')]
79	none	['social-norms']	It is good and expected	keeping a relationship between two people.	4.0	not wanting a threesome with my husband	It is good and expected to keep a relationship between two people.	[Token(lemma='keep', pos='VERB')]
80	none	['social-norms']	socially unacceptable	Smelling bad	4.0	wanting to keep some smelly hair conditioner	Smelling bad is socially unacceptable.	[Token(lemma='smell', pos='VERB')]
81	none	['social-norms']	socially unacceptable	Smelling bad	3.0	wanting to keep some smelly hair conditioner	Smelling bad is socially unacceptable.	[Token(lemma='smell', pos='VERB')]
82	none	['advice']	it is important	telling people how you feel	3.0	being hurt by my ex and what he said and telling him my true feelings	It is important to tell people how you feel.	[Token(lemma='tell', pos='VERB'), Token(lemma='feel', pos='VERB')]
83	none	['advice']	it's important	telling people how you feel.	3.0	being hurt by my ex and what he said and telling him my true feelings	It is important to tell people how you feel.	[Token(lemma='tell', pos='VERB'), Token(lemma='feel', pos='VERB')]
84	none	['description']	It's understandable to	being frustrated when other people are spreading negativity.	False	being annoyed with my husband's constant misery	It's understandable to be frustrated when other people are spreading negativity.	[Token(lemma='frustrate', pos='VERB'), Token(lemma='spread', pos='VERB')]
85	none	['description']	It's understandable	being frustrated when other people are spreading negativity.	False	being annoyed with my husband's constant misery	It's understandable to be frustrated when other people are spreading negativity.	[Token(lemma='frustrate', pos='VERB'), Token(lemma='spread', pos='VERB')]
86	none	['advice']	It is good	saving money.	4.0	wanting to keep some smelly hair conditioner	It is good to save money.	[Token(lemma='save', pos='VERB')]
87	none	['advice']	It is good	saving money.	3.0	wanting to keep some smelly hair conditioner	It is good to save money.	[Token(lemma='save', pos='VERB')]
88	none	['social-norms']	Should	Being sympathetic to your partner when they are not feeling well.	4.0	being annoyed with my husband's constant misery	You should be sympathetic to your partner when they are not feeling well.	[Token(lemma='feel', pos='VERB')]
89	none	['social-norms']	It is mean	calling a friend names.	3.0	calling my friend a attention whore	It is mean to call a friend names.	[Token(lemma='call', pos='VERB')]
90	none	['morality-ethics']	It is mean	calling a friend names.	4.0	calling my friend a attention whore	It is mean to call a friend names.	[Token(lemma='call', pos='VERB')]
91	none	['advice', 'description']	should be	making some decisions only between a child's biological parents	3.0	being offended that my boyfriend's baby mama just wants to only communicate with him regarding their child	Some decisions should be made only between a child's biological parents.	[Token(lemma='make', pos='VERB')]
92	none	['social-norms']	it is expected	being honest with a friend.	3.0	calling my friend a attention whore	It is expected that you can be honest with a friend.	[]
93	none	['morality-ethics', 'social-norms']	it is expected	being able to be honest with a friend.	3.0	calling my friend a attention whore	It is expected that you can be honest with a friend.	[]
94	none	['social-norms']	it's polite	repeating yourself if someone does not understand you.	4.0	repeating that I have asd after a guy makes me uncomfortable	It is polite to repeat yourself if someone does not understand you.	[Token(lemma='repeat', pos='VERB'), Token(lemma='understand', pos='VERB')]
95	none	['morality-ethics']	it's polite	repeating yourself if someone does not understand you.	4.0	repeating that I have asd after a guy makes me uncomfortable	It is polite to repeat yourself if someone does not understand you.	[Token(lemma='repeat', pos='VERB'), Token(lemma='understand', pos='VERB')]
96	none	['social-norms']	It is understanble and okay	wanting to be included in decisions that effect a child you are raising.	False	being offended that my boyfriend's baby mama just wants to only communicate with him regarding their child	It is understanble and okay to want to be included in decisions that effect a child you are raising.	[Token(lemma='want', pos='VERB'), Token(lemma='include', pos='VERB'), Token(lemma='effect', pos='VERB'), Token(lemma='raise', pos='VERB')]
97	none	['morality-ethics', 'social-norms']	It is understanble and okay	wanting to be included in decisions that effect a child you are raising.	4.0	being offended that my boyfriend's baby mama just wants to only communicate with him regarding their child	It is understanble and okay to want to be included in decisions that effect a child you are raising.	[Token(lemma='want', pos='VERB'), Token(lemma='include', pos='VERB'), Token(lemma='effect', pos='VERB'), Token(lemma='raise', pos='VERB')]
98	none	['advice']	It's good	being tactful when talking to a friend.	3.0	calling my friend a attention whore	It is good to be tactful when talking to a friend.	[Token(lemma='talk', pos='VERB')]
99	none	['social-norms']	It is good	being tactful when talking to a friend.	4.0	calling my friend a attention whore	It is good to be tactful when talking to a friend.	[Token(lemma='talk', pos='VERB')]
100	none	['social-norms']	It is necessary	Communication being open between all adults involved in raising a child	2.0	being offended that my boyfriend's baby mama just wants to only communicate with him regarding their child	It is neccesary for there to be open comminication between all adults involved in raising a child.	[Token(lemma='involve', pos='VERB'), Token(lemma='raise', pos='VERB')]
